{
  "schema_version": "1.0",
  "sample_sha256": "aaaaaaaaaaaaaaaaaaaaaaaaaaaaaaaaaaaaaaaaaaaaaaaaaaaaaaaaaaaaaaaa",
  "sample_md5": "aaaaaaaaaaaaaaaaaaaaaaaaaaaaaaaa",
  "sample_sha1": "aaaaaaaaaaaaaaaaaaaaaaaaaaaaaaaaaaaaaaaa",
  "file_type": "PE32+ executable (GUI) x86-64",
  "static_risk_score": 42.0,
  "static_hypotheses": ["packed", "suspicious_imports:CreateRemoteThread"],
  "yara": {
    "fast_hits": ["fixture_packer_hint"],
    "deep_hits": []
  },
  "clamav": {
    "status": "not_detected",
    "signature": null
  },
  "vt_lookup": "unavailable"
}
